{"schema":"MWS_AGENCY_ROLE_OUTPUT/1.0","invocation_id":"canary-product-manager-01","task_id":"CANARY-TASK-01","role_name":"Product Manager","role_source":"/Users/mac/.codex/agents/product-manager.toml","status":"PASS","findings":["GAME_SYSTEM=MULTI_GAME_POWERED_BY_QUESTION_BANK","GAME-01 name=OLYMPIA","GAME-01 reference status=NEEDS_HUMAN_REFERENCE_CONFIRMATION"],"evidence_refs":["docs/project/PROJECT_MASTER_MAP.md:25","project-state/PIMATH-PROJECT-STATE.json:640","project-state/PIMATH-PROJECT-STATE.json:642","project-state/PIMATH-PROJECT-STATE.json:643","project-state/PIMATH-PROJECT-STATE.json:644"],"checks_performed":["Read the installed Product Manager role definition.","Compared the authorized game-system, GAME-01 name, and reference-status fields across both authoritative sources.","Confirmed both sources agree; no game details were proposed or implemented."],"unresolved_risks":["GAME-01 reference remains subject to human reference confirmation."],"next_owner":"Multi-Agent Systems Architect","gate_status":"PASS"}