{"schema":"MWS_AGENCY_ROLE_OUTPUT/1.0","invocation_id":"canary-test-automation-01","task_id":"CANARY-TASK-03","role_name":"Test Automation Engineer","role_source":"/Users/mac/.codex/agents/test-automation-engineer.toml","status":"REVIEW","findings":["Both prior artifacts conform to MWS_AGENCY_ROLE_OUTPUT/1.0 and contain all required output fields.","Prior role_name values exactly match their installed role definitions and role_source paths.","All three invocation IDs are distinct: canary-product-manager-01, canary-architecture-review-01, and canary-test-automation-01.","Prior artifacts use separate output paths: product-manager.json and architecture-review.json.","Product Manager findings agree with both authoritative sources on the multi-game system, GAME-01/OLYMPIA identity, and pending human reference confirmation.","Architecture Review core findings agree with the authoritative multi-game and Question Bank contract statements.","Architecture Review's unresolved claim that QB-2B remains NEEDS_REVALIDATION reflects the historical section of PROJECT_MASTER_MAP.md but conflicts with current PASS records elsewhere in both authoritative sources; status scope requires Evidence Collector review."],"evidence_refs":["/Users/mac/.codex/agents/test-automation-engineer.toml:1","/Users/mac/.codex/agents/product-manager.toml:1","/Users/mac/.codex/agents/multi-agent-systems-architect.toml:1","agency/evidence/runtime-canary/product-manager.json:1","agency/evidence/runtime-canary/architecture-review.json:1","docs/project/PROJECT_MASTER_MAP.md:25","docs/project/PROJECT_MASTER_MAP.md:125","docs/project/PROJECT_MASTER_MAP.md:218","docs/project/PROJECT_MASTER_MAP.md:628","docs/project/PROJECT_MASTER_MAP.md:629","project-state/PIMATH-PROJECT-STATE.json:186","project-state/PIMATH-PROJECT-STATE.json:640","project-state/PIMATH-PROJECT-STATE.json:642","project-state/PIMATH-PROJECT-STATE.json:643","project-state/PIMATH-PROJECT-STATE.json:644"],"checks_performed":["Read the installed Test Automation Engineer role definition.","Parsed and inspected both prior evidence artifacts without modification.","Validated schema identifiers, required fields, exact role identities, installed role sources, distinct invocation IDs, and distinct artifact paths.","Compared prior findings and risks against the human-readable and machine-readable authoritative sources.","Checked current versus historical QB-2B status statements for cross-source consistency."],"unresolved_risks":["QB-2B has conflicting status scope: current module records report PASS, while the historical reconstruction section says final completion NEEDS_REVALIDATION.","No persisted output path for CANARY-TASK-03 was supplied; this response does not alter or overwrite prior artifacts."],"next_owner":"Evidence Collector","gate_status":"REVIEW"}