{"schema":"MWS_AGENCY_ROLE_OUTPUT/1.0","invocation_id":"canary-reality-checker-0101r","task_id":"CANARY-TASK-05","role_name":"Reality Checker","role_source":"/Users/mac/.codex/agents/reality-checker.toml","status":"PASS","findings":["Current canary evidence proves four separate upstream role invocations through unique role identities, invocation IDs, thread IDs, JSON/JSONL paths, and filesystem identities.","Product Manager lead and Multi-Agent Systems Architect reviewer artifacts are separate, and each JSON artifact exactly matches its own event stream's final structured message.","Test Automation Engineer and Evidence Collector ran as subsequent independent roles; the Evidence Collector recorded artifact identities, hashes, event correspondence, and the dirty-worktree baseline.","No self-certification occurred: lead, architecture review, test automation, evidence collection, and this Reality Checker invocation have distinct responsibilities and identities.","The negative fixture proves fail-closed behavior: an unavailable required reviewer produced BLOCK through the explicit failClosed path, with no generic role substitution.","The Project Master and project-state BLOCK values describe the pre-remediation canary baseline. They require an update from this result but do not invalidate the current evidence.","This PASS certifies the requested runtime-canary properties only; it does not certify product, release, architecture completeness, Question Bank non-mutation, or production readiness."],"evidence_refs":["agency/evidence/runtime-canary-01r/product-manager.json","agency/evidence/runtime-canary-01r/product-manager.events.jsonl","agency/evidence/runtime-canary-01r/architecture-review.json","agency/evidence/runtime-canary-01r/architecture-review.events.jsonl","agency/evidence/runtime-canary-01r/test-automation.json","agency/evidence/runtime-canary-01r/test-automation.events.jsonl","agency/evidence/runtime-canary-01r/evidence-index.json","agency/evidence/runtime-canary-01r/evidence-index.events.jsonl","agency/evidence/runtime-canary-01r/negative-fallback.json","agency/runtime/run-canary.mjs:78","agency/runtime/run-canary.mjs:96","docs/project/PROJECT_MASTER_MAP.md:18","docs/project/PROJECT_MASTER_MAP.md:34","project-state/PIMATH-PROJECT-STATE.json:707","project-state/PIMATH-PROJECT-STATE.json:719"],"checks_performed":["Read the installed Reality Checker role definition.","Recorded the read-only git-status baseline.","Validated the schemas, identities, ownership chain, statuses, and evidence references of all prior JSON artifacts.","Confirmed four unique upstream thread IDs across the supplied JSONL event streams.","Confirmed each upstream JSON artifact exactly matches its corresponding event stream's final structured agent message.","Confirmed separate artifact and event paths with distinct filesystem inodes.","Inspected the negative-fixture implementation and confirmed it resolves an intentionally absent role into an explicit BLOCK without invoking a generic fallback.","Treated authoritative runtime status as the stated pre-canary baseline and performed no writes."],"unresolved_risks":["Authoritative Project Master and project-state runtime fields remain stale until an authorized owner records this remediation-canary result.","The canary evidence directory is untracked, so durable source-control retention is not established.","Architecture review retains unresolved interface-versioning, ownership, compatibility, migration, and Question Bank non-mutation evidence gaps.","Human release approval remains mandatory; this canary PASS is not a production-release decision."],"next_owner":"Human Release Approver","gate_status":"PASS"}