{"schema":"MWS_AGENCY_ROLE_OUTPUT/1.0","invocation_id":"canary-product-manager-0101r","task_id":"CANARY-TASK-01","role_name":"Product Manager","role_source":"/Users/mac/.codex/agents/product-manager.toml","status":"PASS","findings":["GAME_SYSTEM=MULTI_GAME_POWERED_BY_QUESTION_BANK","GAME-01 name=OLYMPIA","GAME_01_REFERENCE_STATUS=NEEDS_HUMAN_REFERENCE_CONFIRMATION"],"evidence_refs":["docs/project/PROJECT_MASTER_MAP.md:36","project-state/PIMATH-PROJECT-STATE.json:640","project-state/PIMATH-PROJECT-STATE.json:642","project-state/PIMATH-PROJECT-STATE.json:643","project-state/PIMATH-PROJECT-STATE.json:644"],"checks_performed":["Read the installed Product Manager role definition.","Compared the authorized game-system, GAME-01 name, and reference-status values across both authoritative sources.","Confirmed the two sources agree; performed no writes or game-detail design."],"unresolved_risks":[],"next_owner":"Multi-Agent Systems Architect","gate_status":"PASS"}