{"schema":"MWS_AGENCY_ROLE_OUTPUT/1.0","invocation_id":"canary-test-automation-0101r","task_id":"CANARY-TASK-03","role_name":"Test Automation Engineer","role_source":"/Users/mac/.codex/agents/test-automation-engineer.toml","status":"PASS","findings":["Both prior JSON artifacts conform to MWS_AGENCY_ROLE_OUTPUT/1.0 with the required field set and valid status values.","Product Manager and Multi-Agent Systems Architect have exact, distinct role names, role sources, task IDs, and invocation IDs.","Each role has separate JSON and JSONL output paths with distinct filesystem identities.","Each JSON artifact exactly matches the final structured agent message in its corresponding events JSONL.","Prior findings agree with both authoritative sources on the shared Question Bank, GAME-01=OLYMPIA, and the unresolved human-reference requirement.","The approved macOS host-native zsh policy was followed; no earlier artifact was altered."],"evidence_refs":["/Users/mac/.codex/agents/test-automation-engineer.toml","agency/evidence/runtime-canary-01r/product-manager.json","agency/evidence/runtime-canary-01r/product-manager.events.jsonl","agency/evidence/runtime-canary-01r/architecture-review.json","agency/evidence/runtime-canary-01r/architecture-review.events.jsonl","docs/project/PROJECT_MASTER_MAP.md:18","docs/project/PROJECT_MASTER_MAP.md:34","docs/project/PROJECT_MASTER_MAP.md:36","docs/project/PROJECT_MASTER_MAP.md:154","project-state/PIMATH-PROJECT-STATE.json:640","project-state/PIMATH-PROJECT-STATE.json:642"],"checks_performed":["Read the installed Test Automation Engineer role definition.","Validated both prior JSON artifacts structurally and semantically.","Compared exact role identities, role sources, task IDs, and invocation IDs.","Confirmed two unique invocation IDs across two unique roles and role sources.","Confirmed separate artifact/event paths and distinct inodes.","Parsed final agent messages from both JSONL files and proved exact equality with their JSON artifacts.","Cross-checked prior findings against both authoritative sources.","Confirmed the expected Test Automation output paths were absent before this response and performed no writes."],"unresolved_risks":["This checkpoint does not certify the overall Agency runtime or release; the authoritative project state still records current_agency_execution_certified=false and requires downstream evidence and independent review."],"next_owner":"Evidence Collector","gate_status":"PASS"}