{"schema":"MWS_AGENCY_ROLE_OUTPUT/1.0","invocation_id":"canary-reality-checker-01","task_id":"CANARY-TASK-05","role_name":"Reality Checker","role_source":"/Users/mac/.codex/agents/reality-checker.toml","status":"BLOCK","findings":["Distinct invocation IDs, role identities, role-source paths, artifact paths, and sequential ownership handoffs support separate lead and reviewer artifacts.","The artifacts alone do not conclusively prove separate executable role invocations; the authoritative master explicitly states AGENCY_RUNTIME_EXECUTION=NOT_CURRENTLY_CERTIFIED.","Evidence collection failed: the Evidence Collector returned BLOCK, inspected no evidence contents, and supplied no evidence references.","No self-certification is apparent: Product Manager findings were reviewed by different named roles, and final approval remains assigned to a human.","No silent fallback occurred: the Evidence Collector reported its unavailable required runtime and blocked instead of substituting an unapproved role or certifying the evidence.","The complete canary claim is not proven because successful independent evidence collection and certified runtime separation are missing."],"evidence_refs":["/Users/mac/.codex/agents/reality-checker.toml:1","docs/project/PROJECT_MASTER_MAP.md:21","docs/project/PROJECT_MASTER_MAP.md:23","project-state/PIMATH-PROJECT-STATE.json:389","project-state/PIMATH-PROJECT-STATE.json:595","project-state/PIMATH-PROJECT-STATE.json:596","project-state/PIMATH-PROJECT-STATE.json:597","project-state/PIMATH-PROJECT-STATE.json:605","project-state/PIMATH-PROJECT-STATE.json:610","project-state/PIMATH-PROJECT-STATE.json:613","agency/evidence/runtime-canary/product-manager.json:1","agency/evidence/runtime-canary/architecture-review.json:1","agency/evidence/runtime-canary/test-automation.json:1","agency/evidence/runtime-canary/evidence-index.json:1"],"checks_performed":["Read the installed Reality Checker role definition.","Compared invocation IDs, role identities, role sources, artifact paths, and next-owner handoffs across all four prior artifacts.","Checked lead/reviewer separation, no-self-certification, G6, human-in-the-loop, and no-silent-fallback requirements against both authoritative sources.","Verified that the Evidence Collector explicitly blocked and provided no collected evidence references.","Applied the Reality Checker requirement that claims remain blocked when direct runtime and evidence proof are incomplete."],"unresolved_risks":["Separate JSON artifacts may represent distinct outputs without proving distinct executable role processes.","No successful Evidence Collector artifact establishes independent inspection of the canary evidence set.","The authoritative project record still marks Agency runtime execution as not currently certified.","G6 Evidence & Release cannot pass until independent evidence collection succeeds and a human release approver decides."],"next_owner":"Human Release Approver","gate_status":"BLOCK"}