{"schema":"MWS_AGENCY_ROLE_OUTPUT/1.0","invocation_id":"canary-evidence-collector-01","task_id":"CANARY-TASK-04","role_name":"Evidence Collector","role_source":"/Users/mac/.codex/agents/evidence-collector.toml","status":"BLOCK","findings":["Canary evidence could not be collected because the project-mandated PowerShell executables (`pwsh` and `powershell`) are unavailable in the runtime.","No evidence contents were inspected, modified, or used to certify release readiness."],"evidence_refs":[],"checks_performed":["Attempted read-only inspection using `pwsh`; executable was not found.","Attempted fallback using Windows PowerShell (`powershell`); executable was not found."],"unresolved_risks":["The installed role definition was not readable through the required shell.","The authoritative project sources and prior canary evidence inputs remain unverified.","Actual evidence paths and contents cannot be confirmed from this invocation."],"next_owner":"Reality Checker","gate_status":"NOT_APPLICABLE"}